{
  "schema_version": 1,
  "releaseId": "2026.10.2",
  "createdAt": "2026-10-09T11:29:48Z",
  "description": "Sotto 350M is the Smart Cleanup model, Quill retired. Also Parakeet NPU builds, TitaNet-small speaker labels and cloud model tiers.",
  "catalogs": {
    "speech": {
      "filename": "model_catalog.json",
      "sha256": "6b93dcb5559dbfd792b235db3cc66e5ddd88f454fe85961f63be8de7cc3c7802",
      "sizeBytes": 53927
    },
    "diarization": {
      "filename": "speaker_diarization_manifest.json",
      "sha256": "229b8094db91950594ca6338e2f73dffe7d84c521e7fead0a5140a1e77b7a65a",
      "sizeBytes": 1438
    },
    "cleanup": {
      "filename": "cleanup_model_catalog.json",
      "sha256": "d7258896fdb5b04765b0b44d25ba98d5dda952866df46a948f2db5eb391fde8d",
      "sizeBytes": 11604
    },
    "cloudTiers": {
      "filename": "cloud_model_tiers.json",
      "sha256": "24b9241acdfdba085aeb3d57d67d6e54c6e47aa65bc38a0f5850dae559e409d0",
      "sizeBytes": 11668
    }
  },
  "gitCommit": "648e772e574804ccc89bc4c01387988f82f0f4c2"
}
