{
  "schema_version": 1,
  "releaseId": "2026.10.7",
  "createdAt": "2026-10-25T12:20:31Z",
  "description": "ScribeKey Fast v1 production with re-recorded examples (corrections, fillers, numbers, questions); supersedes the unpromoted 2026.10.6. Needs app build 22+.",
  "catalogs": {
    "speech": {
      "filename": "model_catalog.json",
      "sha256": "467d2864e5ea0a95ef026c66b795b99c33e526ef5aba457e28eaec15fd796cbd",
      "sizeBytes": 58156
    },
    "diarization": {
      "filename": "speaker_diarization_manifest.json",
      "sha256": "229b8094db91950594ca6338e2f73dffe7d84c521e7fead0a5140a1e77b7a65a",
      "sizeBytes": 1438
    },
    "cleanup": {
      "filename": "cleanup_model_catalog.json",
      "sha256": "4db25b103e5e6fde29ffa49de44ef06727ed0a3dfce9f38f4a5a204f97bc9329",
      "sizeBytes": 16317
    },
    "cloudTiers": {
      "filename": "cloud_model_tiers.json",
      "sha256": "8277f19fc41308b5aafb8de6f02e8cef1af25100971d4661f87d21aa16a4ae05",
      "sizeBytes": 19524
    }
  },
  "gitCommit": "f9d481e1208dc326895056d772864be3b875e929"
}
