{
  "schema_version": 1,
  "releaseId": "2026.09.7",
  "createdAt": "2026-09-27T11:14:37Z",
  "description": "Cleanup presentation metadata",
  "catalogs": {
    "speech": {
      "filename": "model_catalog.json",
      "sha256": "c2f7449bcabe5a8aeb26d09005f0e3ea0ede2ff47e080b7a60fba097663d5d24",
      "sizeBytes": 41045
    },
    "diarization": {
      "filename": "speaker_diarization_manifest.json",
      "sha256": "7f6d32bb6a20b9ad26a03130645b7dbfaecc97d785dca6538a92f05b5f8cde45",
      "sizeBytes": 1521
    },
    "cleanup": {
      "filename": "cleanup_model_catalog.json",
      "sha256": "cb57a3ad6f632096c920bdda2aeb5490ce29cf85eb7615e4da2dd08fd011ba51",
      "sizeBytes": 3247
    }
  },
  "gitCommit": "fb543380433da60b988f9921466c8a905344a521"
}
