{
  "schema_version": 1,
  "releaseId": "2026.09.4",
  "createdAt": "2026-09-27T06:48:49Z",
  "description": "Experimental models flagged in the catalogue",
  "catalogs": {
    "speech": {
      "filename": "model_catalog.json",
      "sha256": "c2f7449bcabe5a8aeb26d09005f0e3ea0ede2ff47e080b7a60fba097663d5d24",
      "sizeBytes": 41045
    },
    "diarization": {
      "filename": "speaker_diarization_manifest.json",
      "sha256": "7f6d32bb6a20b9ad26a03130645b7dbfaecc97d785dca6538a92f05b5f8cde45",
      "sizeBytes": 1521
    },
    "cleanup": {
      "filename": "cleanup_model_catalog.json",
      "sha256": "50649bf2a0a2d38172448dcc74b840ff5ba301d6c1ea90be3a2aef681658a697",
      "sizeBytes": 1182
    }
  },
  "gitCommit": "d47ca7adee36b272f4128836cbf48d83feebdb1e"
}
