{
  "schema_version": 1,
  "releaseId": "2026.09.11",
  "createdAt": "2026-09-29T12:42:17Z",
  "description": "Parakeet Ultra offered alongside Parakeet v3",
  "catalogs": {
    "speech": {
      "filename": "model_catalog.json",
      "sha256": "ca59194c73f267055f28cffe6fda363c522d6249131d5ea61b5315709ef0a6e3",
      "sizeBytes": 43927
    },
    "diarization": {
      "filename": "speaker_diarization_manifest.json",
      "sha256": "7f6d32bb6a20b9ad26a03130645b7dbfaecc97d785dca6538a92f05b5f8cde45",
      "sizeBytes": 1521
    },
    "cleanup": {
      "filename": "cleanup_model_catalog.json",
      "sha256": "2e23730d2d97a5ee23d405ebe3acae3891cf9a34d31cffb8f2d2caa88cb5133b",
      "sizeBytes": 7549
    }
  },
  "gitCommit": "672ce7f2c512b3cb3c3a9e8732d28cec822c31b6"
}
