{
  "schema_version": 1,
  "releaseId": "2026.10.4",
  "createdAt": "2026-10-09T21:41:59Z",
  "description": "Smart Cleanup moves to a Sotto tune that punctuates spoken lists and applies corrections inside them.",
  "catalogs": {
    "speech": {
      "filename": "model_catalog.json",
      "sha256": "6b93dcb5559dbfd792b235db3cc66e5ddd88f454fe85961f63be8de7cc3c7802",
      "sizeBytes": 53927
    },
    "diarization": {
      "filename": "speaker_diarization_manifest.json",
      "sha256": "229b8094db91950594ca6338e2f73dffe7d84c521e7fead0a5140a1e77b7a65a",
      "sizeBytes": 1438
    },
    "cleanup": {
      "filename": "cleanup_model_catalog.json",
      "sha256": "bbc2649a3d4c702d717123445da5dd5e0003587698128219f6b06d1909e6688b",
      "sizeBytes": 12036
    },
    "cloudTiers": {
      "filename": "cloud_model_tiers.json",
      "sha256": "24b9241acdfdba085aeb3d57d67d6e54c6e47aa65bc38a0f5850dae559e409d0",
      "sizeBytes": 11668
    }
  },
  "gitCommit": "c26660f81d56b524cc25c46c6ce370f2a19d0688"
}
