{
  "schema_version": 1,
  "releaseId": "2026.09.5",
  "createdAt": "2026-09-27T08:59:40Z",
  "description": "Recorded cleanup examples",
  "catalogs": {
    "speech": {
      "filename": "model_catalog.json",
      "sha256": "c2f7449bcabe5a8aeb26d09005f0e3ea0ede2ff47e080b7a60fba097663d5d24",
      "sizeBytes": 41045
    },
    "diarization": {
      "filename": "speaker_diarization_manifest.json",
      "sha256": "7f6d32bb6a20b9ad26a03130645b7dbfaecc97d785dca6538a92f05b5f8cde45",
      "sizeBytes": 1521
    },
    "cleanup": {
      "filename": "cleanup_model_catalog.json",
      "sha256": "b430ef3759b86c9b6c71a38610da6c9ae4e89ca1f40a33f9d39f52b12b033a77",
      "sizeBytes": 2294
    }
  },
  "gitCommit": "40c80f4149959062ba865027de74455d5a720200"
}
