{
  "schema_version": 1,
  "releaseId": "2026.09.6",
  "createdAt": "2026-09-27T09:04:33Z",
  "description": "Cleanup examples a phone would insert",
  "catalogs": {
    "speech": {
      "filename": "model_catalog.json",
      "sha256": "c2f7449bcabe5a8aeb26d09005f0e3ea0ede2ff47e080b7a60fba097663d5d24",
      "sizeBytes": 41045
    },
    "diarization": {
      "filename": "speaker_diarization_manifest.json",
      "sha256": "7f6d32bb6a20b9ad26a03130645b7dbfaecc97d785dca6538a92f05b5f8cde45",
      "sizeBytes": 1521
    },
    "cleanup": {
      "filename": "cleanup_model_catalog.json",
      "sha256": "a8dc832be6fa2e1569ff1bf6068391f958ca13d98dd5188df1b248586dae2fb7",
      "sizeBytes": 2644
    }
  },
  "gitCommit": "5b3c5ef9dca637f2ca2b35a99d68461541f093e2"
}
